"GO.ID","Term","Annotated","Significant","Expected","Rank.in.p.value_classic","p.value_elim","p.value_classic","genes"
"GO:0030049","muscle filament sliding",39,4,0.1,2,6.9e-07,2.9e-06,"ACTA1,MYH2,MYH4,MYH7"
"GO:0032099","negative regulation of appetite",11,2,0.03,7,0.00017,0.00035,"GHSR,NPFF"
"GO:0060135","maternal process involved in female pregnancy",59,3,0.15,10,0.00016,0.00046,"GHSR,NPFF,PGR"
"GO:0014819","regulation of skeletal muscle contraction",13,2,0.03,11,0.00024,0.00049,"ATP2A1,MYH7"
"GO:0070293","renal absorption",16,2,0.04,15,0.00037,0.00076,"KLHL3,SLC9A3R1"
"GO:0014821","phasic smooth muscle contraction",17,2,0.04,17,0.00042,0.00086,"GDNF,GHSR"
"GO:0043501","skeletal muscle adaptation",25,2,0.06,20,0.00093,0.00186,"ACTA1,MYH7"
"GO:0048729","tissue morphogenesis",583,6,1.5,24,0.01057,0.00356,"ACTA1,GDNF,KLHL3,MYH7,PGR,SLC9A3R1"
"GO:0046676","negative regulation of insulin secretion",37,2,0.1,25,0.00203,0.00406,"GHSR,NPFF"
"GO:0045933","positive regulation of muscle contraction",42,2,0.11,27,0.00261,0.0052,"ATP2A1,GHSR"
"GO:0050433","regulation of catecholamine secretion",49,2,0.13,34,0.00354,0.00702,"GDNF,GHSR"
"GO:0099173","postsynapse organization",156,3,0.4,36,0.00276,0.00747,"DOCK10,GDNF,GHSR"
"GO:0032501","multicellular organismal process",6503,25,16.7,41,0.00643,0.00846,"ACTA1,ARID4A,ATP2A1,BARX1,BHLHE22,DOCK10,GDNF,GHSR,HIF3A,KLHL3,KNG1,METRNL,MME,MYH1,MYH2,MYH4,MYH7,NPFF,ODF3,PGR,PIK3R6,PPP1R11,SERPINA3,SLC9A3R1,ULK2"
"GO:0050710","negative regulation of cytokine secretion",56,2,0.14,44,0.00459,0.00909,"GHSR,PPP1R11"
"GO:0043550","regulation of lipid kinase activity",59,2,0.15,46,0.00509,0.01005,"EEF1A2,PIK3R6"
"GO:0008016","regulation of heart contraction",195,3,0.5,53,0.00516,0.01366,"ATP2A1,MYH7,NPFF"
"GO:0002064","epithelial cell development",196,3,0.5,54,0.00524,0.01385,"ARID4A,PGR,SLC9A3R1"
"GO:0072078","nephron tubule morphogenesis",70,2,0.18,55,0.00709,0.01394,"GDNF,KLHL3"
"GO:0035239","tube morphogenesis",779,6,2,56,0.03078,0.01402,"GDNF,GHSR,HIF3A,KLHL3,PGR,PIK3R6"
"GO:0065008","regulation of biological quality",3637,16,9.34,58,0.00691,0.01521,"ARID4A,ATP2A1,DOCK10,GDNF,GHSR,KLHL3,KNG1,METRNL,MME,MYH7,NPFF,PIK3R6,SERPINA3,SLC9A3R1,ULK2,USP40"
"GO:0022600","digestive system process",84,2,0.22,65,0.01008,0.01967,"GHSR,SERPINA3"
"GO:0009628","response to abiotic stimulus",1086,7,2.79,66,0.00277,0.01975,"ACTA1,CASP8AP2,EEF1A2,HIF3A,METRNL,MME,SORD"
"GO:0002027","regulation of heart rate",88,2,0.23,72,0.01101,0.02146,"MYH7,NPFF"
"GO:0019233","sensory perception of pain",89,2,0.23,74,0.01126,0.02192,"MME,NPFF"
"GO:0021510","spinal cord development",89,2,0.23,75,0.01126,0.02192,"GDNF,NPFF"
"GO:0006954","inflammatory response",638,5,1.64,80,0.00537,0.02313,"GHSR,KNG1,METRNL,NPFF,SERPINA3"
"GO:0051934","catecholamine uptake involved in synaptic transmission",10,1,0.03,82,0.01795,0.0254,"GDNF"
"GO:0034770","histone H4-K20 methylation",10,1,0.03,83,0.01795,0.0254,"ARID4A"
"GO:0051561","positive regulation of mitochondrial calcium ion concentration",10,1,0.03,84,0.01795,0.0254,"ATP2A1"
"GO:0051583","dopamine uptake involved in synaptic transmission",10,1,0.03,85,0.01795,0.0254,"GDNF"
"GO:0060456","positive regulation of digestive system process",10,1,0.03,86,0.01795,0.0254,"GHSR"
"GO:0031987","locomotion involved in locomotory behavior",10,1,0.03,87,0.01795,0.0254,"GHSR"
"GO:0002002","regulation of angiotensin levels in blood",10,1,0.03,88,0.01795,0.0254,"MME"
"GO:0060123","regulation of growth hormone secretion",10,1,0.03,89,0.01795,0.0254,"GHSR"
"GO:2000253","positive regulation of feeding behavior",10,1,0.03,90,0.01795,0.0254,"GHSR"
"GO:0071888","macrophage apoptotic process",11,1,0.03,93,0.01973,0.0279,"GHSR"
"GO:0051657","maintenance of organelle location",11,1,0.03,94,0.01973,0.0279,"ATP2A1"
"GO:0060088","auditory receptor cell stereocilium organization",11,1,0.03,95,0.01973,0.0279,"SLC9A3R1"
"GO:0033605","positive regulation of catecholamine secretion",11,1,0.03,96,0.01973,0.0279,"GDNF"
"GO:2000650","negative regulation of sodium ion transmembrane transporter activity",11,1,0.03,97,0.01973,0.0279,"SLC9A3R1"
"GO:0048484","enteric nervous system development",11,1,0.03,98,0.01973,0.0279,"GDNF"
"GO:0061684","chaperone-mediated autophagy",12,1,0.03,106,0.02151,0.0304,"EEF1A2"
"GO:0014061","regulation of norepinephrine secretion",12,1,0.03,107,0.02151,0.0304,"GHSR"
"GO:0072216","positive regulation of metanephros development",12,1,0.03,108,0.02151,0.0304,"GDNF"
"GO:0003337","mesenchymal to epithelial transition involved in metanephros morphogenesis",12,1,0.03,109,0.02151,0.0304,"GDNF"
"GO:0033604","negative regulation of catecholamine secretion",12,1,0.03,110,0.02151,0.0304,"GHSR"
"GO:0006857","oligopeptide transport",12,1,0.03,111,0.02151,0.0304,"SLC9A3R1"
"GO:1902306","negative regulation of sodium ion transmembrane transport",12,1,0.03,112,0.02151,0.0304,"SLC9A3R1"
"GO:0090399","replicative senescence",12,1,0.03,113,0.02151,0.0304,"MME"
"GO:0071679","commissural neuron axon guidance",12,1,0.03,114,0.02151,0.0304,"GDNF"
"GO:0048521","negative regulation of behavior",12,1,0.03,115,0.02151,0.0304,"GHSR"
"GO:0014831","gastro-intestinal system smooth muscle contraction",12,1,0.03,116,0.02151,0.0304,"GHSR"
"GO:0048243","norepinephrine secretion",13,1,0.03,117,0.02328,0.03289,"GHSR"
"GO:0002093","auditory receptor cell morphogenesis",13,1,0.03,118,0.02328,0.03289,"SLC9A3R1"
"GO:0014067","negative regulation of phosphatidylinositol 3-kinase signaling",13,1,0.03,119,0.02328,0.03289,"SLC9A3R1"
"GO:0030252","growth hormone secretion",13,1,0.03,120,0.02328,0.03289,"GHSR"
"GO:0045989","positive regulation of striated muscle contraction",13,1,0.03,121,0.02328,0.03289,"ATP2A1"
"GO:0045408","regulation of interleukin-6 biosynthetic process",13,1,0.03,122,0.02328,0.03289,"GHSR"
"GO:0010642","negative regulation of platelet-derived growth factor receptor signaling pathway",13,1,0.03,123,0.02328,0.03289,"SLC9A3R1"
"GO:0009605","response to external stimulus",2068,10,5.31,126,0.01806,0.03395,"ACTA1,CASP8AP2,GDNF,GHSR,KNG1,METRNL,NPFF,PPP1R11,SORD,ULK2"
"GO:0007586","digestion",113,2,0.29,127,0.01771,0.03408,"GHSR,SERPINA3"
"GO:0009653","anatomical structure morphogenesis",2381,11,6.12,130,0.01184,0.035,"ACTA1,DOCK10,GDNF,GHSR,HIF3A,KLHL3,MYH7,PGR,PIK3R6,SLC9A3R1,ULK2"
"GO:0050728","negative regulation of inflammatory response",115,2,0.3,131,0.0183,0.03519,"GHSR,METRNL"
"GO:0031644","regulation of neurological system process",115,2,0.3,132,0.0183,0.03519,"GHSR,NPFF"
"GO:0007512","adult heart development",14,1,0.04,133,0.02505,0.03538,"MYH7"
"GO:0032225","regulation of synaptic transmission, dopaminergic",14,1,0.04,134,0.02505,0.03538,"GDNF"
"GO:0030240","skeletal muscle thin filament assembly",14,1,0.04,135,0.02505,0.03538,"ACTA1"
"GO:0051645","Golgi localization",14,1,0.04,136,0.02505,0.03538,"SLC9A3R1"
"GO:0060009","Sertoli cell development",14,1,0.04,137,0.02505,0.03538,"ARID4A"
"GO:0045198","establishment of epithelial cell apical/basal polarity",14,1,0.04,138,0.02505,0.03538,"SLC9A3R1"
"GO:0014733","regulation of skeletal muscle adaptation",14,1,0.04,139,0.02505,0.03538,"MYH7"
"GO:0090494","dopamine uptake",14,1,0.04,140,0.02505,0.03538,"GDNF"
"GO:1905564","positive regulation of vascular endothelial cell proliferation",14,1,0.04,141,0.02505,0.03538,"GHSR"
"GO:0051969","regulation of transmission of nerve impulse",14,1,0.04,142,0.02505,0.03538,"GHSR"
"GO:0022612","gland morphogenesis",117,2,0.3,143,0.0189,0.03632,"PGR,SLC9A3R1"
"GO:0050801","ion homeostasis",725,5,1.86,144,0.00912,0.03729,"ATP2A1,KLHL3,KNG1,NPFF,SLC9A3R1"
"GO:0072283","metanephric renal vesicle morphogenesis",15,1,0.04,145,0.02681,0.03786,"GDNF"
"GO:0002070","epithelial cell maturation",15,1,0.04,146,0.02681,0.03786,"PGR"
"GO:0033033","negative regulation of myeloid cell apoptotic process",15,1,0.04,147,0.02681,0.03786,"GHSR"
"GO:0010155","regulation of proton transport",15,1,0.04,148,0.02681,0.03786,"SLC9A3R1"
"GO:0090335","regulation of brown fat cell differentiation",15,1,0.04,149,0.02681,0.03786,"METRNL"
"GO:0090493","catecholamine uptake",15,1,0.04,150,0.02681,0.03786,"GDNF"
"GO:0042226","interleukin-6 biosynthetic process",15,1,0.04,151,0.02681,0.03786,"GHSR"
"GO:0099645","neurotransmitter receptor localization to postsynaptic specialization membrane",15,1,0.04,152,0.02681,0.03786,"GHSR"
"GO:0099633","protein localization to postsynaptic specialization membrane",15,1,0.04,153,0.02681,0.03786,"GHSR"
"GO:0006000","fructose metabolic process",15,1,0.04,154,0.02681,0.03786,"SORD"
"GO:1902683","regulation of receptor localization to synapse",15,1,0.04,155,0.02681,0.03786,"GHSR"
"GO:0002576","platelet degranulation",123,2,0.32,157,0.02076,0.03977,"KNG1,SERPINA3"
"GO:0030033","microvillus assembly",16,1,0.04,158,0.02858,0.04033,"SLC9A3R1"
"GO:0019585","glucuronate metabolic process",16,1,0.04,159,0.02858,0.04033,"SORD"
"GO:0001991","regulation of systemic arterial blood pressure by circulatory renin-angiotensin",16,1,0.04,160,0.02858,0.04033,"MME"
"GO:0048486","parasympathetic nervous system development",16,1,0.04,161,0.02858,0.04033,"GDNF"
"GO:0043567","regulation of insulin-like growth factor receptor signaling pathway",16,1,0.04,162,0.02858,0.04033,"GHSR"
"GO:0021516","dorsal spinal cord development",16,1,0.04,163,0.02858,0.04033,"GDNF"
"GO:0006063","uronic acid metabolic process",16,1,0.04,164,0.02858,0.04033,"SORD"
"GO:0080182","histone H3-K4 trimethylation",16,1,0.04,165,0.02858,0.04033,"ARID4A"
"GO:0014866","skeletal myofibril assembly",16,1,0.04,166,0.02858,0.04033,"ACTA1"
"GO:0045834","positive regulation of lipid metabolic process",124,2,0.32,167,0.02108,0.04036,"EEF1A2,GHSR"
"GO:0010766","negative regulation of sodium ion transport",17,1,0.04,170,0.03034,0.0428,"SLC9A3R1"
"GO:0015874","norepinephrine transport",17,1,0.04,171,0.03034,0.0428,"GHSR"
"GO:0032354","response to follicle-stimulating hormone",17,1,0.04,172,0.03034,0.0428,"GHSR"
"GO:0006349","regulation of gene expression by genetic imprinting",17,1,0.04,173,0.03034,0.0428,"ARID4A"
"GO:2000696","regulation of epithelial cell differentiation involved in kidney development",17,1,0.04,174,0.03034,0.0428,"GDNF"
"GO:0036124","histone H3-K9 trimethylation",17,1,0.04,175,0.03034,0.0428,"ARID4A"
"GO:0048485","sympathetic nervous system development",17,1,0.04,176,0.03034,0.0428,"GDNF"
"GO:0099170","postsynaptic modulation of chemical synaptic transmission",17,1,0.04,177,0.03034,0.0428,"GHSR"
"GO:0001573","ganglioside metabolic process",17,1,0.04,178,0.03034,0.0428,"B3GALT4"
"GO:0097067","cellular response to thyroid hormone stimulus",17,1,0.04,179,0.03034,0.0428,"GHSR"
"GO:0072079","nephron tubule formation",17,1,0.04,180,0.03034,0.0428,"GDNF"
"GO:0007597","blood coagulation, intrinsic pathway",17,1,0.04,181,0.03034,0.0428,"KNG1"
"GO:0090190","positive regulation of branching involved in ureteric bud morphogenesis",17,1,0.04,182,0.03034,0.0428,"GDNF"
"GO:0014065","phosphatidylinositol 3-kinase signaling",129,2,0.33,183,0.02269,0.04334,"PIK3R6,SLC9A3R1"
"GO:0030534","adult behavior",129,2,0.33,184,0.02269,0.04334,"GDNF,GHSR"
"GO:0048513","animal organ development",3116,13,8,187,0.00849,0.04514,"ACTA1,ARID4A,BARX1,DOCK10,GDNF,GHSR,KLHL3,MME,MYH7,NPFF,PGR,PIK3R6,SLC9A3R1"
"GO:0002526","acute inflammatory response",132,2,0.34,188,0.02368,0.04517,"NPFF,SERPINA3"
"GO:0035089","establishment of apical/basal cell polarity",18,1,0.05,190,0.03209,0.04526,"SLC9A3R1"
"GO:0030277","maintenance of gastrointestinal epithelium",18,1,0.05,191,0.03209,0.04526,"SERPINA3"
"GO:1905276","regulation of epithelial tube formation",18,1,0.05,192,0.03209,0.04526,"GDNF"
"GO:0060117","auditory receptor cell development",18,1,0.05,193,0.03209,0.04526,"SLC9A3R1"
"GO:0101023","vascular endothelial cell proliferation",18,1,0.05,194,0.03209,0.04526,"GHSR"
"GO:0010224","response to UV-B",18,1,0.05,195,0.03209,0.04526,"MME"
"GO:1905562","regulation of vascular endothelial cell proliferation",18,1,0.05,196,0.03209,0.04526,"GHSR"
"GO:0072077","renal vesicle morphogenesis",18,1,0.05,197,0.03209,0.04526,"GDNF"
"GO:0051580","regulation of neurotransmitter uptake",19,1,0.05,198,0.03385,0.04772,"GDNF"
"GO:0002438","acute inflammatory response to antigenic stimulus",19,1,0.05,199,0.03385,0.04772,"NPFF"
"GO:0097242","amyloid-beta clearance",19,1,0.05,200,0.03385,0.04772,"MME"
"GO:0044062","regulation of excretion",19,1,0.05,201,0.03385,0.04772,"SLC9A3R1"
"GO:0030859","polarized epithelial cell differentiation",19,1,0.05,202,0.03385,0.04772,"SLC9A3R1"
"GO:0060231","mesenchymal to epithelial transition",19,1,0.05,203,0.03385,0.04772,"GDNF"
"GO:1902074","response to salt",19,1,0.05,204,0.03385,0.04772,"GHSR"
"GO:0032691","negative regulation of interleukin-1 beta production",19,1,0.05,205,0.03385,0.04772,"GHSR"
"GO:0002313","mature B cell differentiation involved in immune response",19,1,0.05,206,0.03385,0.04772,"DOCK10"
"GO:0048670","regulation of collateral sprouting",19,1,0.05,207,0.03385,0.04772,"ULK2"
"GO:0072087","renal vesicle development",19,1,0.05,208,0.03385,0.04772,"GDNF"
